,id,question,Motivation,Intent,QueryGoal,title,hcluster_id
669,6e7ac4bdb81013ef64a3ed5ad9b941ca,Which all season tires are best in snow?,Gain,consideration,Needs,Top 10 Best All Season Tires for Snow in 2018 – Reviews,142
869,933276ecb733c96c19b0f8360220ed68,Which all season tires are best?,Gain,consideration,Attributes,10 Best All Season Tires (Review & Buying Guide) in 2018 | Car Bibles,142
64,15f142d6dd166c0b847e7748487d9d0d,Which are the best SUVs?,Gain,consideration,Attributes,46 Best SUVs of 2018: Ranked | CarMax,141
707,3a9184a23b73633ec8ce56b116f1ab95,Which brand tires are the best?,Gain,consideration,Attributes,Best Tire Buying Guide - Consumer Reports,141
130,b677b260fb6389aacc183eb608c92879,Which car has the best ride comfort?,Gain,awareness,Benefits,Luxury Cars With the Most Comfortable Ride - Consumer Reports,364
133,e67009a285f156c57f0d3f8e8886aa1d,Which car has the best suspension?,Gain,awareness,Features,10 Cars with the Best Suspension | Autobytel.com,364
183,551cb381073c4cc91d0e984c79164ff5,Which car has the smoothest ride?,Gain,awareness,Benefits,10 Cars with the Smoothest Ride | Autobytel.com,365
242,ab01d8d90104ef3e0dd449ce5b601701,Which car is the most fun to drive?,Gain,awareness,Benefits,10 Most Fun Cars To Drive | Autobytel.com,62
0,29d611a8acde3ee7ca6ed2216a06f1d8,Which cars have turbo engines?,Gain,awareness,Features,15 Factory Stock Turbo Cars | Autobytel.com,368
236,90e49635eab9f1c205af9d92d1461b9a,Which cars have v6 engines?,Gain,consideration,Features,"20 Sick V6 Cars You Can Buy For Under $20,000 | HotCars",368
102,034ded89913f823fc801b198524dc00e,Which compact SUV has the best ride?,Gain,consideration,Benefits,Practicality Matters: Every Compact Crossover SUV Ranked from ...,364
194,34b748aa063bfa7a880f87c9951a0f91,Which crossover SUV is the best?,Gain,consideration,Attributes,Practicality Matters: Every Compact Crossover SUV Ranked from ...,358
523,3c3283a48358351baaedf98b3d1fcd57,Which dental software is best?,Gain,consideration,Attributes,A Comparison of 10 Dental Practice Management Software Systems,359
1254,a9cc813a7ec579e23e79e7ab1328a5e4,Which is best accounting software for small business?,Gain,consideration,Needs,Top 20 Accounting Software for Small Business in 2018 ...,354
1225,8079fee6c4ea7adc20ff33372ece57b5,Which is the best accounting software?,Gain,consideration,Attributes,15 Best Accounting Software Systems For Your Business ...,358
1261,b8b1f16f92095a6b3f65c831f01a3b8f,Which is the best free accounting software?,Gain,consideration,Attributes,Best Free Accounting Software Solutions to Consider in 2018 ...,358
1150,afd292e1c4bf1ed38d9f297bd79d6863,Which is the best QuickBooks for small businesses?,Gain,conversion,Needs,5 Best Small Business Accounting Software Options 2018,355
1256,0e38de017c2587c3b91a2c36b369008d,Which is the best software for accounting?,Gain,consideration,Needs,15 Best Accounting Software Systems For Your Business ...,355
54,31f68f31e496d102d622d413b6b52fde,Which is the most powerful SUV in the world?,Gain,consideration,Attributes,The 10 Most Powerful SUVs of 2016 - BeautifulLife.info,63
454,5dbd175e6ff0f0b65a1785527b6fb989,Which midsize SUV is the best?,Gain,consideration,Attributes,20 Best Midsize SUVs | U.S. News & World Report,358
1198,d3ee032f28ddcf05331393feec1216fe,Which online accounting software is best?,Gain,consideration,Attributes,Best accounting software for small business in the UK - Simply Business,359
1120,198f5bc4e56439d02e298b7fca54ad89,Which QuickBooks is best for a small business?,Gain,conversion,Needs,5 Best Small Business Accounting Software Options 2018,354
1233,857630f41c018975c1beeb32ce6443b5,Which QuickBooks is best for small business?,Gain,conversion,Needs,5 Best Small Business Accounting Software Options 2018,354
1,37ebb7a6eb97a110932796407b05e34c,Which small SUV has the best engine?,Gain,consideration,Features,10 Most Powerful Small SUVs | Autobytel.com,364
1248,f529f439ff00dd366cc7cab0cecf1334,Which software is best for accounting?,Gain,consideration,Needs,15 Best Accounting Software Systems For Your Business ...,354
1193,0c24186bc0b1a3124691ea739f2b6cf8,Which software is best for small business?,Gain,consideration,Needs,Best Accounting Software for Small Businesses 2018,354
115,6773eb2b5b958eb6c72cfe876c05b2f0,Which SUV has 3rd row?,Gain,consideration,Attributes,Top 15 Cars and SUVs with Third Row Seats of 2016 | CarMax,367
244,68549e2869d90d566f467e394c525897,Which SUV has the best performance?,Gain,consideration,Benefits,10 Best Performance SUVs | Autobytel.com,364
29,ac360e137ec121631a502d57ec5f1b93,Which SUV has the highest driving position?,Gain,consideration,Attributes,The best cars with high driving seating positions | carwow,365
239,cfad3cb2ff7bbfa01237a2074f125d19,Which SUV has the highest horsepower?,Gain,consideration,Attributes,Highest Horsepower SUVS of 2018 | Kelley Blue Book,365
20,af226c316af8e8646d6bb9ddc672ad77,Which SUV has the most interior room?,Gain,consideration,Benefits,Top 11: Three-Row SUVs With The Most Cargo Room,366
184,36954347f107a54ed5bcc61426afa694,Which SUV has the quietest ride?,Gain,consideration,Benefits,The 10 Quietest SUVs | Autobytel.com,365
80,8d3a6d4370cdd6cd96907a73cacb751b,Which SUV is best for long distance driving?,Gain,consideration,Needs,10 of the Best SUVs for Highway Driving | Autobytel.com,354
89,6f87a06da57f7acfafad41ae5e0d2cc7,Which SUV is the smallest?,Gain,consideration,Attributes,Small SUV Comparison: 6 Of The Best Compact SUVs | Autobytel.com,356
200,125902fb56a267e43ca835be829890bd,Which SUVs are body on frame?,Gain,consideration,Features,6 American SUVs That Still Feature Body-on-Frame Construction | Top ...,143
279,bcc182aeaf71dc5dd8dfce55ec5f458b,Which SUVs are built on a truck chassis?,Gain,consideration,Features,10 Best Body-on-Frame SUVs Still on Sale | Autobytel.com,143
333,3a0dceb31f920189e61cf94d72b1f95b,Which SUVs are built on a truck frame?,Gain,consideration,Features,6 American SUVs That Still Feature Body-on-Frame Construction | Top ...,143
268,49d5252bd8bbeea03e65c8b882d07d00,Which SUVs are built on car chassis?,Gain,consideration,Features,10 SUVs That Drive Like A Car | Autobytel.com,143
921,684122a8d3c5f76d92a184551916a054,Which tire brand is best?,Gain,consideration,Attributes,Best Tire Buying Guide - Consumer Reports,359
765,b9ccde8e3a89bc57a233bfdfc9a9c11f,Which tire brand is the best?,Gain,consideration,Attributes,Best Tire Buying Guide - Consumer Reports,358
142,292fd18abd475038731fe17bfe2a8028,Which vehicles have the most comfortable seats?,Gain,awareness,Attributes,10 Cars with the Most Comfortable Seats | Autobytel.com,369
949,643ad5c7719afb09c8ea29d299e03abb,Who make the best tires?,Gain,consideration,Attributes,Best Tire Buying Guide - Consumer Reports,376
838,95db07496b30f4c3f23d41b1d8f67baa,Who makes the best tires in the world?,Gain,consideration,Attributes,10 Best Tire Companies In The World - Updated In 2018 - CAR FROM ...,375
387,bf40bb21636401e74c56f366da00205d,Are all rav4 4wd?,Constraint,conversion,Features,Toyota RAV4 - Wikipedia,173
878,94cf11eaca9fa7d2a438a8800737a631,Are all season tires the same as all terrain?,Constraint,consideration,Attributes,Tires 101 on Different Styles of Tires :: Souza's Tire Service,167
823,36f5c39655ce9370d12cecaac43da2b0,Are all terrain tires all season?,Constraint,consideration,Attributes,All-Season vs. Winter Tires: The Differences of a Cold Climate Tire ...,174
982,8bda393f918484f8985deeb4c01cbd73,Are all weather tires the same as all season tires?,Constraint,consideration,Attributes,The difference between all-weather and all-season tires | Driving,167
872,5975d5413fa0ff2e572ea95e43ac692f,Are BF Goodrich Tires Made in USA?,Constraint,conversion,Features,Local 598 - Made in America Tires - UAW Region 1D,148
867,cdf1e495b917075ab75cc49858aebb38,Are Bfgoodrich tires made by Michelin?,Constraint,conversion,Features,BFGoodrich - Wikipedia,158
962,1e366f048171f8ddf6d95981fcb25847,Are BFGoodrich tires made in USA?,Constraint,conversion,Features,Local 598 - Made in America Tires - UAW Region 1D,148
960,4e43bf65bfd286da473f6d855866e640,Are Bridgestone tires made by Michelin?,Constraint,conversion,Features,Best Tire Buying Guide - Consumer Reports,158
291,9dfa4a70877bd5d404573e61ae71ea90,Are Ford Fusions AWD?,Constraint,conversion,Features,Top 8 All-Wheel Drive Sedans - Autotrader,172
883,81bdf56d07c222ef03e840d8f9fb0181,Are General Tires Made in the USA?,Constraint,conversion,Features,Where Are Your Tires Made? - Consumer Reports,149
780,1577b2fa81b42a6798f955070603f4b0,Are Hankook tires American made?,Constraint,conversion,Features,Made in the USA by Hankook: the Kinergy PT Tire - Consumer Tires ...,159
724,0853fad67fd34761a9cd60f954c820c2,Are new tires covered under warranty?,Constraint,consideration,Attributes,Are you covered? 7 things you may not know about new car warranties,160
1085,0c8c22416281a57a74ff230b4128549c,Are QuickBooks and Quicken compatible?,Constraint,conversion,Features,Quicken & QuickBooks Compatibility | Chron.com,169
1159,7656d68574fc79df367006c02fef22ef,Are QuickBooks and Quicken the same?,Constraint,consideration,Features,Are Quicken And QuickBooks The Same Thing? - Ace Cloud Hosting,170
1098,72ff5a0748fe9ea98caab9a06c04d269,Are QuickBooks files compatible with Quicken?,Constraint,conversion,Features,Quicken & QuickBooks Compatibility | Chron.com,162
1059,d3abc5d9ad39337109834a8764f0d6c4,Are Quicken and QuickBooks compatible?,Constraint,conversion,Features,Quicken & QuickBooks Compatibility | Chron.com,169
1166,8eb3cb4fed821594b7268ac181c4601f,Are Quicken and QuickBooks the same thing?,Constraint,consideration,Features,Are Quicken And QuickBooks The Same Thing? - Ace Cloud Hosting,171
1168,1c3634e04c46f7666dca86eeac330eca,Are Quicken and QuickBooks the same?,Constraint,consideration,Features,Are Quicken And QuickBooks The Same Thing? - Ace Cloud Hosting,170
874,1ff8aea070066de6660c3fcc8e59bb86,Are Uniroyal tires made in the USA?,Constraint,conversion,Features,United States Rubber Company - Wikipedia,149
808,c180f476df12ef345327cdb341b932d0,Are winter tires more expensive?,Constraint,consideration,Attributes,5 Myths about All-Season and Winter Tires | Machine Design,161
814,55a6e5da33a5069649ba45a268224aab,Are winter tires worth it?,Constraint,consideration,Benefits,Are Snow Tires Really Worth It? - Autoblog,165
817,680a7d3830ac027fe91070564a1f4323,Can I buy just one tire?,Constraint,retention,Needs,Do I Need to Replace More Than One Tire at a Time? | News | Cars.com,263
861,84d061a0f91dc3bc229e6c14a49aefb7,Can I buy tires at Sam Club without a membership?,Constraint,conversion,Needs,How to Shop at Sam's Club without a Membership,262
818,6b1c6c0d8a607cce4d454c0bb5945331,Can I have two different size tires on my car?,Constraint,awareness,Needs,One of These Things is Not Like the Other: RNR Talks Two Different ...,253
128,7af552d4c6c9e7af428d99a899c8cd66,Can I look up a car by VIN number?,Constraint,conversion,Features,VIN Lookup and VIN Check | CARFAX,264
876,0ef43d6a530bc235d5df1df94c741966,Can I mix TYRE brands on my car?,Constraint,retention,Needs,What you should know about mixing tyres on your vehicle.,250
692,019b1c80d6a56744cf686dd1752daf73,Can I mix Tyres on my car?,Constraint,retention,Needs,What you should know about mixing tyres on your vehicle.,250
903,eb56cdc3a30c6c054f5331b4c5c2f067,Can I put just two snow tires on my car?,Constraint,awareness,Needs,Winter and Snow Tires | Bridgestone Tires,251
694,aa35fcb2f1eeb08701c76cd6b5f6682f,Can I put one new tire on my car?,Constraint,retention,Needs,Do I Need to Replace More Than One Tire at a Time? | News | Cars.com,254
737,df4264438674eabfba949d45de5a830f,Can I put passenger tires on a light truck?,Constraint,consideration,Needs,Light Truck Tires vs. Passenger Tires - Sears,247
738,52f151cfcd1057266110247bd264c17c,Can I put passenger tires on a trailer?,Constraint,consideration,Needs,Tire Tech Information - Trailer Tires vs. Passenger Vehicle Tires,247
795,827fb9ea5b782bca02cb84b42f615eb0,Can I put two different brands of tires on my car?,Constraint,retention,Needs,What You Should Know about Mixing Tires on Your Vehicle,252
875,bf0334c45b5b4b0a13a0181020ce58e2,Can I put two different size tires on my car?,Constraint,awareness,Needs,One of These Things is Not Like the Other: RNR Talks Two Different ...,251
930,a380d7c572b4694a25e11a5c631d8c92,Can I replace just one tire?,Constraint,retention,Needs,Do I Need to Replace More Than One Tire at a Time? | News | Cars.com,263
736,ec30bf045f51efa17beba6ffd5ecd1f1,Can passenger tires be used on SUV?,Constraint,awareness,Needs,Difference Between Passenger Tires vs. Light Truck Tires | Discount Tire,249
1177,5f7e8e1491434baafcbbe5e2501257f7,Can you be called an accountant without a CPA?,Constraint,awareness,General Interest,Accounting FAQ's | All Accounting Careers,256
1025,11d969bdf13ddfc51aa33bd2e657626c,Can you exchange tires at Discount Tire?,Constraint,conversion,Needs,Return Policy | Discount Tire Direct,274
958,0760ce298158adec3ccab53816bfbc91,Can you install tires yourself?,Constraint,awareness,Needs,Can I Install New Tires Myself? | Blain's Farm & Fleet Blog,273
902,fec8f60ad7b8a53becf244e1ababb5eb,Can you put different size tires on a car?,Constraint,awareness,Needs,RNR Talks Two Different-Sized Tires - RNR Tire Franchises,244
938,d8dfdf4d2fa87e5c9746b4313c711110,Can you put different size tires on your car?,Constraint,awareness,Needs,What You Should Know about Mixing Tires on Your Vehicle,244
770,286f3de369adb4ff641f845d04415b55,Can you put passenger tires on an SUV?,Constraint,awareness,Needs,Tire Trend Alert: Car Tires on an SUV? | autoTRADER.ca,243
897,4366348a4fb4ee7ee66f06b8afe28cb8,Can you replace just 2 tires on an all wheel drive car?,Constraint,retention,Needs,Do You Need to Replace All 4 Tires on Your AWD Vehicle? - Les ...,243
884,bb3c6485509ec58acfcf23058e518f15,Can you return tires to Tire Rack?,Constraint,retention,Features,Return/Refund Policy - Tire Rack,220
1027,ed2c27f48d4bfe8e919828d37f9d81cd,Can you shop at Costco without being a member?,Constraint,conversion,Needs,How to shop at Costco without a membership - Business Insider,262
229,f335359df3607b550156a1ecfdbdfab5,Did Ford stop making cars?,Constraint,retention,Features,Here's when Ford will stop making most of its cars | TechCrunch,391
693,d1da4a520e77ceace03ffcb82fd08842,Do all 4 tires need to match?,Constraint,retention,Needs,Do You Need to Replace All 4 Tires on Your AWD Vehicle? - Les ...,287
969,488c7d3f50920eb1b0b4278732e3a56c,Do all four tires need to be the same brand?,Constraint,retention,Needs,What You Should Know about Mixing Tires on Your Vehicle,286
981,c1f85ba9401fcdc143f91d1898ca135f,Do all season tires have the snowflake?,Constraint,advocacy,Attributes,What is the winter tire symbol? - Kal Tire,284
822,c0f0db45743d866dda38632282c3bfc5,Do all terrain tires get worse gas mileage?,Constraint,consideration,Attributes,Ratings of All-Season and All-Terrain Tires - Consumer Reports,288
725,9cc6b0b95a6fcb994e553a62043df86a,Do Goodyear tires come with a warranty?,Constraint,conversion,Features,"limited warranty, tire care and maintenance guide - Goodyear Tires",329
1147,68f871dd85bb51fc56a003e795539b50,Do I have to buy QuickBooks every year?,Constraint,conversion,Features,QuickBooks - Do I Really Have To Upgrade Every Year?,278
1099,98f5adb89fd3a9a4ee025e5e45d04523,Do I have to pay monthly for QuickBooks?,Constraint,conversion,Features,The Worst-Kept Secret About QuickBooks Online - Forbes,276
970,7549f637ffa4e721454256561d98f140,Do I have to replace all 4 tires on my Subaru?,Constraint,retention,Needs,Boston Subaru Dealer | Subaru Repair Questions | Planet Subaru ...,285
1023,8aa9c211d119f3115ecbd1a44fbb3a3b,Do I have to replace all 4 tires?,Constraint,retention,Needs,Do You Need to Replace All 4 Tires on Your AWD Vehicle? - Les ...,283
1034,3e6c7c10d84516ee87cfb3c26ada9a24,Do I need a 4 wheel alignment with new tires?,Constraint,awareness,Features,"Do I need to get an alignment when I have new tires mounted, and ...",330
1019,f3d9e77904e96f3eab5529df30986a40,Do I really need to replace all four tires at the same time?,Constraint,retention,Needs,Do I really need to replace all four tires at the same time ...,286
442,29cb55fccfbe0e189e894525d504cf56,Do Mazda use Ford engines?,Constraint,conversion,Features,Ford sells 20% stake in Mazda for $538 million; keeps 13% - ABC News,289
280,cb852cd34dcdba8f8cbb0d27b2f64a16,Do modern cars have a chassis?,Constraint,awareness,Features,Vehicle frame - Wikipedia,275
289,c845b0fd1d7ce36f71da0b4308c06c54,Do Mustangs have all wheel drive?,Constraint,conversion,Features,Ford Considering AWD And All-Electric Powertrain For The Next-Gen ...,282
1087,04049d4181fb94fc3ff9acbc562638d4,Do small businesses need a CPA?,Constraint,awareness,Benefits,Why Small Businesses Need a CPA - The Balance Small Business,306
1155,3c64ba19a37a5bded4c4febc380ddbdc,Do small businesses need an accountant?,Constraint,awareness,Benefits,When to Hire an Accountant | Small Business Guide | Xero US,307
292,bffaad25869e225142653778912f21be,Do they still make the Ford Flex?,Constraint,retention,Features,Ford Flex - Wikipedia,326
972,1f95eb3a1a7c0d9fbbeb0e9721803345,Do tires come with warranty?,Constraint,consideration,Features,Understanding Tire Warranties | Edmunds,329
1049,fa4cc31d40597275adc36f7cc78c646d,Do you have to pay monthly for QuickBooks?,Constraint,conversion,Features,The Worst-Kept Secret About QuickBooks Online - Forbes,276
896,3affde36a7ea2066cbe53f1662120307,Do you have to replace 2 tires at a time?,Constraint,retention,Needs,Do I Need to Replace More Than One Tire at a Time? | News | Cars.com,277
968,d65c58c9d4257dce7a32816f5bcef293,Do you have to replace all 4 tires at once?,Constraint,retention,Needs,Do I Need to Replace More Than One Tire at a Time? | News | Cars.com,277
720,6a3ffd4a2005ae6239327fd35b7d761d,Do you need a Costco card to buy tires?,Constraint,conversion,Needs,10 Ways Non-Members Can Shop at Costco | HuffPost,299
1030,23e88252d2adcc64d647332a9d90c596,Do you need a membership for Costco tires?,Constraint,conversion,Needs,Tire Disclaimer | Costco - Costco Wholesale,301
83,1dc098847912766be7922b0e14f3b262,Does a unibody car have a frame?,Constraint,awareness,Features,Vehicle frame - Wikipedia,490
27,df4701e323e9c8540807086f9abdf5c3,Does Avalon have AWD?,Constraint,conversion,Features,Does the 2019 Toyota Avalon offer all-wheel drive? - Toyota Vacaville,490
855,d13b08b607f10ae550dc06c5e29e0ee1,Does Costco do tire repairs?,Constraint,retention,Needs,I bought new tires at Costco three months ago. I got a flat tire ...,468
950,15c88f015f6e70e19cd777ecf88fab19,Does Costco install non Costco tires?,Constraint,conversion,Needs,Tire Disclaimer | Costco - Costco Wholesale,528
728,12f3f1f2ea9589d1def8726f58462b6b,Does Discount Tire buy tires?,Constraint,conversion,Needs,Discount Tires Used Tires FAQ: Do They Sell Them? Buy Them? etc,518
956,da2595c2c3e9ff3a2adef5d3eee166b5,Does Discount Tire charge to install tires?,Constraint,conversion,Features,Cheap Tire Installation - Walmart vs Costco vs Sears | Cheapism,502
730,766e99c96c881cef5d7de2940c6e1864,Does Discount Tire take Amex?,Constraint,conversion,Features,Payment Methods | Apply for Discount Tire Financing | Discount Tire,523
285,8961f2e15368dde522c3b8098c30b721,Does Ford EcoSport have 4 wheel drive?,Constraint,conversion,Features,Ford EcoSport - Wikipedia,490
211,4ac87b147685412768e0f32eed72ebdc,Does Ford EcoSport have all wheel drive?,Constraint,conversion,Features,Ford EcoSport Four-Wheel-Drive Variant Spotted Testing In India ...,492
290,bd94a50d644ef8ee9f15533fd9661ff9,Does Ford Escape have AWD?,Constraint,conversion,Features,Ford Escape Review - Research New & Used Ford Escape Models ...,490
10,cad034890da2423cc3c0e6b379acf3d7,Does Ford Expedition have 3rd row seating?,Constraint,conversion,Features,2018 Ford Expedition Interior | U.S. News & World Report,490
106,be74b7017c201ed4ada4874e64e92307,Does Ford Explorer have 3rd row?,Constraint,conversion,Features,Does the 2018 Ford Explorer Have a Third Row?,490
439,16826392800fcd81ea4cfeace513802d,Does Ford Explorer have 7 seats?,Constraint,conversion,Features,Does the Ford Explorer have 3rd row seating? - Western Slope Auto,490
254,72e839dca48317382177eafa32726746,Does Ford make a diesel expedition?,Constraint,conversion,Features,"Ford Provides F-150, Expedition Engine Specs, Plans Diesel Option",522
278,369eff7a647ec7f92af6ee445ff1c144,Does Ford still make excursions?,Constraint,retention,Features,Ford Excursion - Wikipedia,521
339,9b740818f4b266bf3ce24a5ac7b219d4,Does Ford still make expedition?,Constraint,retention,Features,Ford Expedition - Wikipedia,521
317,a615ea3cee6268403d4937118caddeaa,Does Ford still make the excursion?,Constraint,retention,Features,Ford Excursion - Wikipedia,520
149,482b0182d33b788ee81e5a05f4eeed73,Does Ford still make the expedition?,Constraint,retention,Features,Ford Expedition - Wikipedia,520
1093,4471c1c03c3126ffe85f1dcbc6b4a479,Does QuickBooks cost money?,Constraint,conversion,Features,The Worst-Kept Secret About QuickBooks Online - Forbes,518
1160,444822a2545fabdb534e641f23993981,Does QuickBooks work with Quicken?,Constraint,conversion,Features,Difference Between Quicken & QuickBooks | Chron.com,530
26,0e3c1af7a0cf2452dc7dc4b41c8a234c,Does rav4 have AWD or 4wd?,Constraint,conversion,Features,AWD vs 4WD | Toyota Dealer near Me - Bob Smith Toyota,491
859,efbd79fd294b1edd324f79aa775a6079,Does Sam's Club tire price include installation?,Constraint,conversion,Features,"Best cheap tire services: Wal-Mart, Sam's, Costco or Sears?",518
754,f1cc13799f2a5bc02e9151b0a1e0813f,Does Sam's tire price include installation?,Constraint,conversion,Features,"Best cheap tire services: Wal-Mart, Sam's, Costco or Sears?",518
880,91688ef0a0ff96c1b71ae4479785dee9,Does Sams Club charge for tire installation?,Constraint,conversion,Features,Tire Installation @ Sam's Club,464
733,87f63d2545d3680064a97dfa2b0d7589,Does Sams Club install tires bought elsewhere?,Constraint,conversion,Features,Third-Party Tire Sales and Installation - Sam's Club,527
157,9f044c1f8d4107675818508921a667d3,Does the Ford family still own Ford?,Constraint,awareness,Features,Bill Ford nearly doubles stake in Ford's supervoting shares,529
1014,c88fe70e43afcfa91df473ebe9cfc095,Does Walmart charge for tire installation?,Constraint,conversion,Features,"Best cheap tire services: Wal-Mart, Sam's, Costco or Sears?",464
675,d5b5c7c6db66c243cb064cbc6e6efd2d,Does Walmart have warranty on tires?,Constraint,conversion,Features,LIMITED WARRANTY FOR [INSERT] BRAND TIRES ... - walmart images,493
1008,2312c046ea6dd9b95e05be1ef440e901,Does Walmart install tires bought elsewhere?,Constraint,conversion,Needs,"Best cheap tire services: Wal-Mart, Sam's, Costco or Sears?",527
721,e418cc43bfdb139648d010ce548a0710,Does Walmart install tires free with purchase?,Constraint,conversion,Features,"Auto Services: Oil Changes, Tire Service, Car Batteries and ... - Walmart",530
734,39fbf4dd4a0f8241bbeb0b7ec52880a0,Does Walmart install tires ordered online?,Constraint,conversion,Needs,Walmart.com Help: Ordering Tires Online,518
971,a8d06940e42cb42872bb44b4e79fcc16,Does Walmart offer tire warranty?,Constraint,conversion,Features,limited warranty for [insert] brand tires purchased ... - walmart images,518
1170,4a74dc394400d1497ffb1638be630e11,How can I get QuickBooks certification for free?,Constraint,retention,Features,QuickBooks Certification - Intuit QuickBooks Training,241
1117,de4fad266b55eefa2be04b3dbb19dd8d,How do corporation owners pay themselves?,Constraint,awareness,Needs,How Do Small Business Owners Pay Themselves? The Quick and ...,339
1043,2fe97c8873a4bdda546295fefedbf13d,How do I account for personal expenses in QuickBooks?,Constraint,retention,Features,Pay for personal expenses from a business bank or credit card account,318
1069,252dee2caa81bd62c7c5c5e19fd54066,How do I account for personal expenses in Quickbooks?,Constraint,retention,Features,Pay for personal expenses from a business bank or credit card account,318
1162,aa1751ecf8622527e217eb612bb74679,How do I convert Qdf to QuickBooks?,Constraint,retention,Features,Convert Quicken data to QuickBooks Desktop - QuickBooks Community,309
1042,c5180a6a493091dadc6786b060e198b8,How do I convert Quicken to QuickBooks online?,Constraint,retention,Features,Convert a Quicken file into a QuickBooks Online co... - QuickBooks ...,309
1145,470dda25cb2a28ad0b669636961fb2a2,How do I do payroll without QuickBooks?,Constraint,awareness,Needs,Set up QuickBooks Payroll without Subscription - QuickBooks Learn ...,342
208,4a9437145da2abfa0dc60f305c17365a,How do I find my car chassis number?,Constraint,retention,Features,Complete My Car Check - Cartell Car Check - Cartell.ie,312
432,b9733a7dc7e03aeedd8a21ef02ecc8f8,How do I find my chassis number?,Constraint,retention,Features,Complete My Car Check - Cartell Car Check,312
125,7bb3dbb024852b712aa12657b6430886,How do I find my vehicle chassis number?,Constraint,retention,Features,3 Ways to Find the Chassis and Engine Number - wikiHow,312
475,cbb6d577151531ac7b810dfe8ec177ca,How do I get dentrix certified?,Constraint,retention,Features,Steps to Become a Dentrix Certified Trainer | Dentrix,352
1133,35a417d6e79949e1d52007587d477ea3,How do I import a CSV file into QuickBooks?,Constraint,retention,Features,How to Import a CSV to QuickBooks | Bizfluent,337
1132,0e1eacc8db45779c0df2aaa5c8f24090,How do I import a QIF file into Quicken?,Constraint,retention,Features,Learn the Steps for Downloading and Importing PayPal Into Quicken,337
437,7a0a324a16f44cc8b9fc2ac3758ec787,How do I lookup my VIN number?,Constraint,retention,Features,What is a VIN (Vehicle Identification Number)?| AutoCheck ...,312
1339,64c82a25e7b80a99a825cc6befbeabcc,How do I make a budget spreadsheet?,Constraint,awareness,Needs,Have 5 Minutes? Create a Free Budget Template in Excel - The ...,128
