,id,question,Motivation,Intent,QueryGoal,title,hcluster_id
1352,33dda8dbef6424819015d0ee93f47ac3,What computer skills do accountants need?,Constraint,awareness,Needs,Accounting Skills You Need to Succeed | Robert Half,292
158,008a461aabd051f5b2bd1099b7b98303,What country owns Ford?,Constraint,awareness,General Interest,Ford Motor Company - Wikipedia,54
409,97aa4e5e0151e1c5a990bbcbf91da571,What credit score do you need to lease a car?,Constraint,awareness,Goals,Car Leasing Q&A: What Credit Score Is Needed to Lease a Car ...,298
81,6658c22e67f6ee7f3264e69e226fb27c,What defines a crossover vehicle?,Constraint,awareness,Attributes,Crossover (automobile) - Wikipedia,54
1244,c1d2263d72016e4930ba9391ec7d9a72,What do accountants use?,Constraint,awareness,Benefits,What does an Accountant do? - Sokanu,290
66,cf1e1232d5744b94905ad3322cd87a7f,What do the letters SUV mean?,Constraint,awareness,Attributes,What does SUV stand for? - Car Keys,295
51,ef759247f5391c49392f1e34bbceb168,What do the letters SUV stand for?,Constraint,awareness,Attributes,What Does SUV Stand For? - Autos.com,408
451,42090e4dc96caa91b124e9a8484a725e,What does 1500 stand for on truck?,Constraint,awareness,Features,The Weight Game: Understanding Pickup Classes--And Where They ...,463
1183,d1b6270563a6aa14d9bcc964cd9b807e,What does a bookkeeper do for their clients?,Constraint,awareness,Needs,"Bookkeeping, Accounting, and Auditing Clerks - Bureau of Labor ...",473
548,23634901d981490ad85474ebf15719a7,What does a dental office manager do?,Constraint,awareness,Needs,Dental Office Manager: Job Duties & Career Information - Study.com,469
570,7c51fcf0ae07728dcacc41667386b0cf,What does a dental treatment coordinator do?,Constraint,awareness,Needs,"Treatment Coordinator, Dental Salary - PayScale",469
1363,1ecb0c18dc5a158f61389164b9fa667f,What does a finance manager do?,Constraint,awareness,Needs,Financial Managers - Bureau of Labor Statistics,469
569,51635e3c14f69d8b43cfd303dcf05c6b,What does a new patient coordinator do?,Constraint,awareness,Needs,What's the Job Description of a Patient Care Coordinator? - Learn.org,473
625,4e6f5aca14bb828fe88c825c214359f8,What does a patient coordinator do in a dental office?,Constraint,awareness,Needs,Dental Office Coordinator Salary - PayScale,470
1071,8f0633fa728a2fc6b50c415bf1a3d314,What does a payroll service cost?,Constraint,consideration,Attributes,Small Business Payroll Cost [Update] - SurePayroll,474
636,ece3a68d768605ccf0f00a6d60449744,What does a practice manager do?,Constraint,awareness,Needs,"Physician Practice Manager: Job Description, Duties and Requirements",469
918,5974cda81bc9d8b9ccfe4cd473eca026,What does a tire warranty cover?,Constraint,consideration,Features,Understanding Tire Warranties | Edmunds,474
612,9ed01e415602a28a93edc719de61933f,What does an dental office manager do?,Constraint,awareness,Needs,Dental Office Manager: Job Duties & Career Information - Study.com,471
608,a2c5bba2494671d71bc85e7aa0dcc246,What does an office manager do in a small business?,Constraint,awareness,Needs,How to Hire an Office Manager | Inc.com,472
602,82b43cf8a4366b37321cb91bf7d72302,What does an office manager do?,Constraint,awareness,Needs,What does an Office Manager do? - Sokanu,471
42,e5a7d3b71faa3efa9efc8ef471659fa1,What does body on frame mean?,Constraint,awareness,Features,Body-on-frame - Wikipedia,479
267,d5c2af86c152777938746fe07b3a907b,What does crossover SUV mean?,Constraint,awareness,Attributes,Crossover (automobile) - Wikipedia,484
96,78e9fca1fdabd507e3f3ecc1a563ee75,What does CUV stand for?,Constraint,awareness,Attributes,Crossover (automobile) - Wikipedia,465
534,02ec0ba8e3b53b15950aeb9d98c3caa9,What does dentrix do?,Constraint,consideration,Attributes,Dentrix - Wikipedia,469
531,f289e166735270084f0cb8a12dc67af9,What does dentrix mean?,Constraint,consideration,Attributes,Dentrix - Wikipedia,484
396,66425d67f4edc2efde0f1e3f45b00ef4,What does El mean on Ford Expedition?,Constraint,conversion,Features,Ford Expedition Cars - Edmunds,479
190,d0f57da30f222a0add1c454bc5243281,What does El stand for on expedition?,Constraint,conversion,Features,"2017 Ford Expedition vs Expedition EL | Stone Mountain, Atlanta ...",463
261,b80b9109a054263063298ff4072e3059,What does El stand for on Ford Expedition?,Constraint,conversion,Features,Ford Expedition Cars - Edmunds,463
187,a5e24f60ebdafb8345f1d978354660ff,What does Expedition EL mean?,Constraint,conversion,Features,Ford Expedition - Edmunds,484
453,a9462b897967e0cf1ee316de4c8faddf,What does f150 mean?,Constraint,conversion,Features,"What Does Half-Ton, Three-Quarter-Ton, One-Ton Mean When ...",484
1337,f8e1d8de2f37defb1ef63c863e78f62e,What does financial literacy mean to you and why is it important?,Constraint,awareness,Needs,The meaning of financial literacy and its importance - Futurpreneur ...,123
1306,fbc88bf51dbcddcc9be881971ef152be,What does financial management include?,Constraint,awareness,General Interest,Strategic Financial Management - Investopedia,474
61,a0f25255304a12fc73e887b768abced9,What does Ford Expedition XLT mean?,Constraint,conversion,Features,Ford Expedition Cars - Edmunds,484
103,2b9c06a699389bcbcd571f20cb03585f,What does fx4 mean on a Ford?,Constraint,conversion,Features,What is the Difference Between FX4 and 4X4 Fords? | It Still Runs,479
891,663c11b1dc99b665f78beab15b980473,What does highway tire mean?,Constraint,consideration,Attributes,What do these symbols mean in your SUV tire? – H/T A/T M/T ...,484
703,feafe9c8b280512ddc7e2df278d00247,What does HT stand for on tires?,Constraint,conversion,Features,What do these symbols mean in your SUV tire? – H/T A/T M/T ...,463
1206,8516a598d9b34ab26a4e6f98442a0d23,What does Microsoft Dynamics AX stand for?,Constraint,conversion,Features,Microsoft Dynamics AX - Wikipedia,465
53,75091030c1cd8a579efe0fc2db4abf2d,What does MPV and SUV mean?,Constraint,awareness,Attributes,Compact MPV - Wikipedia,483
833,48ffe99f18616d0dee60044741f9ea06,What does Passenger all season mean?,Constraint,consideration,Attributes,What's the difference between passenger and performance tires? - Kal ...,485
1121,2b92d993e80f279f6214a3ed0343385e,What does QuickBooks cost?,Constraint,conversion,Features,The Worst-Kept Secret About QuickBooks Online - Forbes,474
512,1859221d294a8a33b8e32130023706c9,What does RVG mean?,Constraint,conversion,Features,RVG - What does RVG stand for? The Free Dictionary,484
393,2c0a7a251411d992ae7bf720a3a2ff5b,What does SUV and MPV mean?,Constraint,awareness,Attributes,Compact MPV - Wikipedia,483
342,e7c7c3ea04bf9ffb7730c4bc18090c28,What does SUV mean?,Constraint,awareness,Attributes,SUV definition and meaning | Collins English Dictionary,484
322,ac08328e366db16a32f2f62242036774,What does SUV stand for in vehicles?,Constraint,awareness,Attributes,What does SUV stand for? - Car Keys,466
231,994827322a7accee3fe5d50b68040c7f,What does the F in F series trucks stand for?,Constraint,conversion,Features,Ford F-Series - Wikipedia,467
232,236cf281e93c1f40bede41ca6d0c897c,What does the XLT on a Ford mean?,Constraint,conversion,Features,"What does xl, xlt, stx stand for? (If anything.) - Ford F150 Forum ...",480
886,9a61e7294a6c1097b722b97a2da7f0e2,What does treadwear mean on tires?,Constraint,awareness,Features,"Treadwear, Traction and Temperature - LinkedIn",479
215,4703eb089ec75a5f68d4c5edb7690365,What does unibody mean on a car?,Constraint,awareness,Features,Unibody vs Body On Frame - Which Is Best? - YouTube,479
433,26415f586ba9f1c33b3527f3ac0bd9e2,What does VIN number tell you?,Constraint,awareness,Features,How to Quickly Decode Your VIN | Edmunds,525
885,27456f2071912882a9bfd04684703eaf,What does Walmart charge for tire installation?,Constraint,conversion,Features,"Best cheap tire services: Wal-Mart, Sam's, Costco or Sears?",465
797,c57e99abd6212ea5a49c14602697a416,What does Walmart charge to put on tires?,Constraint,conversion,Features,"Best cheap tire services: Wal-Mart, Sam's, Costco or Sears?",481
455,0ed9db9291f4350d163ba70894486ec3,What does XLT mean on a Ford Expedition?,Constraint,conversion,Features,"What does xl, xlt, stx stand for? (If anything.) - Ford F150 Forum ...",479
413,6210ffb031d38301abfd2eb614031c27,What does XLT mean on a Ford Explorer?,Constraint,conversion,Features,"What does xl, xlt, stx stand for? (If anything.) - Ford F150 Forum ...",479
13,0495debda02ef0245de9de32faa731a2,What does XLT mean on Ford Expedition?,Constraint,conversion,Features,"What does xl, xlt, stx stand for? (If anything.) - Ford F150 Forum ...",479
368,62d357f63ff1c0ffd9c876524aca6d39,What does XLT mean on Ford?,Constraint,conversion,Features,"What does xl, xlt, stx stand for? (If anything.) - Ford F150 Forum ...",479
337,5c28a35c40a884677838766c37adccbb,What does XLT stand for on a Ford Escape?,Constraint,conversion,Features,What Is the Difference Between the Escape XLS & XLT? | It Still Runs,463
305,7a6e48f86008c2e79f3a1f4f35d8ec22,What does XLT stand for on a Ford Explorer?,Constraint,conversion,Features,"What does xl, xlt, stx stand for? (If anything.) - Ford F150 Forum ...",463
162,91b4a3a124f3c6a5155c588ec6e3c805,What does XLT stand for on Ford Escape?,Constraint,conversion,Features,What Is the Difference Between the Escape XLS & XLT? | It Still Runs,463
123,e6cda35e57cc4fb5b593147b0163ee9c,What engine will the 2017 Ford Raptor have?,Constraint,conversion,Features,2017 Ford F-150 Raptor Engine Options and Performance,488
1398,dc2abf2dc7bf72145582eb83a5bf447b,What financial management is all about?,Constraint,awareness,Needs,2. What is Financial Management? - FundsforNGOs,45
1418,e059cfb760032f832e5fe748a7bb58b6,What financial management means?,Constraint,awareness,Needs,Financial management - Wikipedia,54
260,7ee18ceec183734ef086c4cb7be1bba1,What gas mileage does a Ford Excursion get?,Constraint,conversion,Features,Ford Excursion Review - Research New & Used Ford Excursion ...,526
793,34bcb7a8f666cf2a5c4849bfd0302bd3,WHAT IS A all season tire?,Constraint,consideration,Attributes,Winter & Snow Tires vs. All Season Tires | Bridgestone Tires,46
847,fc9e24b7c8b3f3cc339a28e122aec7ce,What is a at tire?,Constraint,consideration,Features,What do these symbols mean in your SUV tire? – H/TA/TM/T - Yokohama,66
98,2d8b850a9a2f21da3b02aab3a1f93d6e,What is a BMW SAV?,Constraint,awareness,Features,BMW X Models - BMW USA,1
134,333ba2c6bf142693fd44df679d88a0ed,What is a crossover car SUV?,Constraint,awareness,Attributes,Crossover (automobile) - Wikipedia,1
416,1cc780f3b5c9cc79d7140e7b24a40cf8,What is a crossover SUV mean?,Constraint,awareness,Attributes,Crossover (automobile) - Wikipedia,56
179,572f45d66670c8ea96e617615ee7cd12,What is a crossover SUV vehicle?,Constraint,consideration,Attributes,Crossover (automobile) - Wikipedia,1
222,0890120bce518eeb2575a6bdf832d1d5,What is a CUV tire?,Constraint,advocacy,Attributes,"An apples-to-apples look at light truck, SUV and CUV tires - Retail ...",1
749,f09c557986346d23652458d312ff8e6a,What is a disposal fee?,Constraint,awareness,Attributes,Electronic Waste Recycling Fee - Wikipedia,1
1335,ca0fe57aae96e687199d706659b8dad1,What is a financial literacy program?,Constraint,awareness,Needs,Six Steps to Creating a Financial Literacy Program in Your - National ...,1
1344,83cb988e7191871885e8d283299619d6,What is a financial process?,Constraint,awareness,Needs,Financial process development - Greenstep,1
161,248ba78dc95877a3424c473a90e81d35,What is a Ford XLT package?,Constraint,conversion,Features,What is the Ford STX Package? | Ford - Granger Motors,1
768,fc020a2b85ed2d3ddbaaa7a076a78a66,What is a light truck tire?,Constraint,consideration,Attributes,Passenger Vs. Light Truck tires | TireBuyer.com,1
1203,0e5a16aa74411bff18cc2bd7e9ecba6c,What is a QDF file?,Constraint,conversion,Features,What is QDF? What Opens a QDF? File Format List from WhatIs.com,1
1171,e30bca4a74595a13ff46e1a66de0423f,What is a QuickBooks Certified ProAdvisor?,Constraint,conversion,Features,Find an Accountant: QuickBooks ProAdvisor - Intuit,1
465,5414e3a94a61fdbdd95d28c50b15fc84,What is a Styleside bed?,Constraint,consideration,Features,Truck Bed Styles Guide - RealTruck.com,1
989,350597d2def686440fc31647a4538eda,What is a tire disposal fee?,Constraint,awareness,Features,Waste tire management fee - Department of Taxation and Finance,1
727,43f832e5b0e31363b6bd385a97cde3cf,What is a tire mileage warranty?,Constraint,consideration,Features,Why Tread-Life Warranties are Next to Useless - Consumer Reports,1
786,159568d0fb38de99f7f69861666a2ffd,What is a tire rack?,Constraint,consideration,Features,Tire & Wheel Packages | Tire Rack,1
911,6372e08c616431985c847c41a2eb68aa,What is a touring tire?,Constraint,awareness,Attributes,Defining touring tires - Retail - Modern Tire Dealer,1
129,d85250298058fc066be823cc2d04eb82,What is a unibody design?,Constraint,awareness,Features,Unibody vs Body On Frame - Which Is Best? - YouTube,1
199,fd80f9dc79622259dfb7ec2cb890fba0,What is a unibody frame?,Constraint,awareness,Features,Unibody vs Body On Frame - Which Is Best? - YouTube,1
124,687c133f8a894f9c9da71d4a1f5e0f56,What is a unibody on a car?,Constraint,awareness,Features,Unibody vs Body On Frame - Which Is Best? - YouTube,53
464,5f8f1d988253f868dd35a21adffbd10b,What is an F 150 SuperCab?,Constraint,conversion,Features,2018 Ford F-150 Regular Cab vs Super Cab vs SuperCrew,441
1305,99694b9bdac4835da2141eff4cfafbf5,What is basic financial management?,Constraint,awareness,Needs,All About Financial Management in Business - Free Management Library,1
307,a0b6a397970620910bfdefdba383c10d,What is body SUV frame?,Constraint,awareness,Features,Body-on-frame - Wikipedia,1
436,cb83be8fae4a08606009790d6b38fc50,What is car serial number?,Constraint,awareness,Features,Vehicle Identification Number (VIN) - Carfax,1
207,8209f4d4d30620df61537b8fb4bac7f6,What is chassis number?,Constraint,awareness,General Interest,What is a VIN (Vehicle Identification Number)?| AutoCheck ...,1
388,a2f8a386e14a6962812f91fb0ee375e5,What is chassis of a car?,Constraint,awareness,General Interest,Chassis - Wikipedia,57
434,5c304f5eb304036773b235ce8576e41a,What is chassis?,Constraint,awareness,Features,What is chassis? - Definition from WhatIs.com,1
1251,0fe2c505f5883f03739448d08ec20f78,What is cloud account?,Constraint,awareness,Attributes,Cloud storage - Wikipedia,1
1218,796983cea99fe04a12cc294ddfd9b5b8,What is cloud accounting?,Constraint,awareness,Attributes,What is Cloud Accounting Software? Webopedia Definition,1
1204,d03a03786688f4fe277eff08adb06324,What is cloud based accounting?,Constraint,consideration,Attributes,What is Cloud Accounting Software? Webopedia Definition,1
299,f11566c3cec0f094a035612089847b50,What is considered a crossover vehicle?,Constraint,awareness,Attributes,Crossover (automobile) - Wikipedia,1
116,9bd201872097afcf5e256ac1162981f3,What is considered unibody damage?,Constraint,retention,Needs,Unibody Damage | Auto Fraud Attorney | Car Dealership Fraud Laws,1
672,8f25c24bc8696420e50779137a3e7d6a,What is cost of the tire disposal fee at Walmart?,Constraint,conversion,Features,What You Need to Know to Save the Most on New Tires - The Krazy ...,66
404,1901f36179ae45884b3bdd4eee0309b8,What is crossover SUV mean?,Constraint,awareness,Attributes,Crossover (automobile) - Wikipedia,56
205,1b70b452bd2db33f0b1b08b505653f7c,What is CUV vs SUV?,Constraint,awareness,Attributes,SUV vs. Crossover: What's the Difference? - Autotrader,443
505,824a1d0d23400881040fc55a585cb4f3,What is dentrix ascend?,Constraint,conversion,Features,Frequently Asked Questions | Dentrix Ascend,1
476,a171a42ceda423f389be77c81cf3f601,What is dentrix dental software?,Constraint,conversion,Features,Leader in Dental Practice Management Software | Dentrix,1
519,c2f50a1c25d2f0eb80c418a0f81814d6,What is dentrix enterprise?,Constraint,conversion,Features,dentrix enterprise 7.0 system requirements - Indian Health Service,1
539,6ced237ed34a840b6282bde732b74bb6,What is dentrix experience?,Constraint,conversion,Attributes,Dentrix - Wikipedia,1
535,b9b2d568de83c62f2184a48a97fb37db,What is dentrix system?,Constraint,conversion,Features,Dentrix - Wikipedia,1
936,46e04ba33edcbbb9d82e6c2d488d1ab9,What is difference between all season and all weather tires?,Constraint,consideration,Attributes,The difference between all-weather and all-season tires | Driving,41
323,6fc0dc823ea9e77cdaf3ef85991565d9,What is difference between car and SUV?,Constraint,awareness,Attributes,SUV vs. Crossover: What's the Difference? - Autotrader,36
12,0d39638a1ef38a63f97ab53303a7bd4a,What is difference between expedition and expedition?,Constraint,conversion,Features,Ford Expedition Cars - Edmunds,36
321,97f582cbc61bb1bfa7acf54dc4717de6,What is difference between frame and chassis?,Constraint,awareness,Features,What is the difference between chassis and frame? - Quora,36
266,ad2f15eef723ad9c92051882b998651e,What is difference between SUV and crossover?,Constraint,awareness,Attributes,SUV vs. Crossover: What's the Difference? - Autotrader,36
95,24afc98afc2d072ae5803b1a9e4d58c1,What is difference between SUV and CUV?,Constraint,awareness,Attributes,SUV vs. Crossover: What's the Difference? - Autotrader,36
431,bf9cf780efaa9028d429d33aa1391115,What is difference between SUV and sedan?,Constraint,awareness,Attributes,What is the difference between a sedan and an SUV? - Quora,36
1350,b71c7bae7af91299c2a481bd3c2400da,What is effective financial management?,Constraint,awareness,Goals,Effective Financial Management | ABE UK,1
1228,5def6e5f228ebc1dd5c8c27a48571c58,What is ERP and how does it work?,Constraint,awareness,Attributes,How Does An ERP System Work? - TechRepublic,123
1230,9cf6c52fa090b0d4c52d2fb053c1f369,What is ERP system definition?,Constraint,awareness,Attributes,Enterprise Resource Planning - ERP Definition | Investopedia,1
1271,f400a72ec9ebb4eb75f25c37a4a23c5f,What is financial acumen skills?,Constraint,awareness,Goals,3 Financial Acumen Skills You Don't Want to Ignore,1
1424,185cdb2e8a8330145a3fad29d284fc2b,What is financial literacy and why is it important?,Constraint,awareness,Needs,Why financial literacy is so important | Investopedia,38
1278,e346133cb379c4eb9f6c7e4d724567d5,What is financial literacy class?,Constraint,awareness,Attributes,General Financial Literacy Course - FITC,1
1275,66294fddbf0d198218202de6eb03be52,What is financial literacy training?,Constraint,awareness,Needs,Identifying topics for financial literacy training | Corporation for ...,1
1381,28546e23bd7e25e2e0635f49e7ce39ca,What is financial management all about?,Constraint,awareness,Needs,2. What is Financial Management? - FundsforNGOs,45
1301,c42734814239b51ec59bef365622fc94,What is financial management explain its importance?,Constraint,awareness,Needs,"Financial Management - Meaning, Objectives and Functions",444
1382,755bcb6132cb4d4cb4bff6ca4ce383ae,What is financial management process?,Constraint,awareness,Needs,Financial Management Process - WV Office of Technology - WV.gov,1
84,663f1299633e7c6284459f9c3b79f166,What is Frame unibody damage?,Constraint,retention,Needs,Unibody Damage | Auto Fraud Attorney | Car Dealership Fraud Laws,1
257,ae0c7f0d2719a6792fb4d9da72323665,What is full form MUV?,Constraint,awareness,Attributes,What is the full form of SUV and MUV? - Engineering.com,1
831,437e0814549279cd9848c0a9424bd73c,What is Grand Touring tire?,Constraint,consideration,Features,Grand Touring All-Season Tires - Tire Rack,1
1263,954e7b871374671dfa9966774b556df5,What is Great Plains ERP?,Constraint,consideration,Features,Microsoft Dynamics GP (Great Plains) Software Highlights,1
1262,8b07e224bd98ca237d54281479c7a6b8,What is Great Plains system?,Constraint,consideration,Features,Microsoft Dynamics GP | MIG & Co.,1
1309,6f78aad4e0c76a0c80165dbfb063b1dc,What is healthcare finance?,Constraint,awareness,Needs,introduction to healthcare finance - American College of Healthcare ...,1
1403,ce4a21f4a2d4d2f9e9dd386fde65b742,What is importance of financial accounting?,Constraint,awareness,Needs,"What Is Accounting? - Purpose, Importance & Relationship to ...",57
391,c699e6a47bf6fd9495d48123bde5a892,What is ladder frame chassis?,Constraint,awareness,Features,Vehicle frame - Wikipedia,1
788,5c91796a481b7ce322ee0bb9c9b54090,What is Load Range E?,Constraint,conversion,Features,How to Determine Tire Load Ratings - Maintenance - Work Truck Online,1
1364,02655016e4f20751b2c696f3b01a4471,What is main function of financial manager?,Constraint,awareness,Needs,Eight Must Know Functions of Finance Manager – MIT School of ...,57
1307,a70fe173e66513401166bbaed6b9a047,What is meant by financial management explain its role?,Constraint,awareness,Needs,Financial management - Wikipedia,442
1214,fcbb03e522eef5bcb443d79b92b62fe3,What is Microsoft accounting software?,Constraint,consideration,Features,Microsoft Office Accounting - Wikipedia,1
1267,163b9c4e0f7a5bb26ceff8a46488a486,What is Microsoft Dynamics AX used for?,Constraint,consideration,Benefits,"Microsoft Dynamics AX Software - 2018 Reviews, Pricing & Demo",405
1208,e4166a0a321c6be9fd1d7429c5ad466e,What is Microsoft Dynamics used for?,Constraint,consideration,Benefits,What is Microsoft Dynamics? | On MSFT,405
1209,672635af95caaf3696457a1e7764a48c,What is Microsoft ERP?,Constraint,consideration,Attributes,Microsoft Dynamics ERP - Wikipedia,1
1265,f1b80548c712de957ffd3d1d17b24e65,What is Microsoft Great Plains Software?,Constraint,consideration,Attributes,Microsoft Dynamics GP - Wikipedia,1
1013,3d0cd08fe09ff419fdf8b03cf2354d97,What is NTB value installation package?,Constraint,conversion,Features,"National Tire & Battery TV Commercial, 'Value Installation Package ...",444
1220,29d8f61ab9c005ed577ba566c4373a18,What is online accounting software?,Constraint,awareness,Features,What is Cloud Accounting Software? Webopedia Definition,1
1197,5dc1658cc5b008dd465cf4cb47c75e05,What is online accounting system?,Constraint,awareness,Attributes,E-accounting - Wikipedia,1
1213,0b94dd9d73b5b1c30d9bc5b6e3657ae6,What is online accounting?,Constraint,awareness,Needs,E-accounting - Wikipedia,1
1063,0392dfa12780cd25f6d84fd510849b51,What is QuickBooks and how do you use it?,Constraint,consideration,Attributes,What QuickBooks Is & How Businesses Use It - Fit Small Business,122
1115,177aea1e52607dc1d8dc49372a82423f,What is QuickBooks and its uses?,Constraint,consideration,Benefits,QuickBooks - WhatIs.com - TechTarget,445
1149,3fb52b8bcae1c3a7ca63f3196f26b880,What is QuickBooks good for?,Constraint,consideration,Benefits,What QuickBooks Is & How Businesses Use It - Fit Small Business,6
1111,5c58195c07fa9b40aa74e7905c5ef602,What is QuickBooks software used for?,Constraint,consideration,Benefits,What QuickBooks Is & How Businesses Use It - Fit Small Business,405
513,373058e627c8f44dc76d7f2a031631ae,What is r4 in dentistry?,Constraint,conversion,Attributes,Dental Software | Practice Management Software | Carestream Dental,55
514,12020d36c138a39c5f96b61ce096bba5,What is Softdent dental software?,Constraint,conversion,Attributes,SoftDent - Wikipedia,1
52,33a31eaf343d5c24756460c0f80423af,What is SUV and MUV?,Constraint,awareness,Attributes,"What is the difference between a crossover, SUV and MUV? - Quora",37
419,0d4f98a77cb374b5d6abbb6cee9e3be8,What is SUV crossover mean?,Constraint,awareness,Attributes,Crossover (automobile) - Wikipedia,56
195,759a020d09c983409ec3db0bfaf2ca86,What is SUV meaning in vehicle?,Constraint,awareness,Attributes,Sport utility vehicle - Wikipedia,55
394,615beb370352c4a782eb75709ff0458e,What is SUV MUV MPV?,Constraint,awareness,Attributes,"What is the difference between a crossover, SUV and MUV? - Quora",1
1413,b0a3a180b3fa6dfbbb4d42c97daa6da0,What is the 28 36 rule?,Constraint,advocacy,Needs,28/36 Rule - Investopedia,3
1323,10cbf1c79fe5186d1ef187ccd9a6905d,What is the 30 day rule?,Constraint,advocacy,Needs,Control spending with the 30-day rule - Lifehacker,3
1415,3f82517b9a48caba0927042832f4d7da,What is the 30 percent rule?,Constraint,advocacy,Needs,How Much Should I Spend on Rent? Ignore the '30 Percent Rule ...,3
1320,d618d5bba81cd482e328a8cdae37dd90,What is the 50 20 30 budget rule?,Constraint,advocacy,Needs,The 50/30/20 Budgeting Rule—How It Works - The Balance,3
827,92044eaa05cb847aec03a8ad14ffcc35,What is the average cost to mount and balance tires?,Constraint,consideration,Attributes,Mount And Balance Cost at Tire Rack,17
360,3902b3c16f957ee1615b3d33a7105411,What is the best affordable car to buy?,Constraint,consideration,Needs,10 Most Affordable New Cars | Kelley Blue Book,13
15,8c2ac703ff3ee41d45f6857b1493b58c,What is the best affordable car?,Constraint,consideration,Benefits,Best Cars for the Money Awards 2018 | U.S. News & World Report,18
358,fe8e2bf1f5bf932624b03be603ecf5f3,What is the cheapest car for 2018?,Constraint,consideration,Attributes,The 10 Cheapest New Cars of 2018 - Car and Driver,5
406,40d153693d58d909c5040883fa701490,What is the cheapest car to lease in 2018?,Constraint,consideration,Needs,12 Cheapest Lease Deals for October 2018 - Best Cars - US News ...,76
16,9fc20090312778e2ae069308e82edf62,What is the cheapest car to lease?,Constraint,consideration,Needs,Best Lease Deals: November 2018 - CarsDirect,16
458,10511a9b252f584230e40d1e110d91d2,What is the cheapest fastest car?,Constraint,consideration,Benefits,10 Fast Affordable Cars | Autobytel.com,3
63,b81a86260ee5dbe80fa1b7ef8e6afb45,What is the cheapest Ford?,Constraint,consideration,Attributes,10 cheapest cars: Why (almost) nobody buys them - USA Today,3
407,0c69c40c31aad1d4d74a4c20c78544e5,What is the cheapest luxury car to lease?,Constraint,consideration,Needs,12 Best Luxury Lease Deals Under $400 in October - Best Cars - US ...,16
359,47bf5c4bc08ed83cb9a4e64846aea269,What is the cheapest most reliable car?,Constraint,consideration,Benefits,10 Cheap Reliable Cars | Autobytel.com,60
4,dc154c84dc913e2b707b4037617397c8,What is the cheapest new car 2017?,Constraint,consideration,Attributes,10 cheapest cars: Why (almost) nobody buys them - USA Today,74
